{
  "schema_version": "1.0.0",
  "trace_id": "trace-pair04-flow02",
  "job_type": "INCREMENTAL_CHECK",
  "execution": { "timeout_seconds": 600 },
  "input": {
    "repository": {
      "url": "https://git.nju.edu.cn/pair04/dependency-demo.git",
      "commit": "3333333333333333333333333333333333333333"
    },
    "base_commit": "2222222222222222222222222222222222222222",
    "baseline": {
      "actual_graph_uri": "artifact://pair04/full01/actual.json",
      "commit": "2222222222222222222222222222222222222222",
      "configuration_id": "cc-MODE0"
    },
    "environment": {
      "image_uri": "registry.example.edu/pair04/dependency-demo@sha256:aaaaaaaaaaaaaaaaaaaaaaaaaaaaaaaaaaaaaaaaaaaaaaaaaaaaaaaaaaaaaaaa",
      "configuration_id": "cc-MODE0"
    },
    "project_root": ".",
    "build": {
      "command": "./mvnw -B clean package",
      "verify_command": "./mvnw -B test"
    }
  }
}
