{
  "schema_version": "1.0.0",
  "trace_id": "trace-pair04-flow03",
  "job_type": "REPAIR",
  "execution": { "timeout_seconds": 600 },
  "input": {
    "repository": {
      "url": "https://git.nju.edu.cn/pair04/dependency-demo.git",
      "commit": "3333333333333333333333333333333333333333"
    },
    "error_report_uri": "artifact://pair04/full01/md-only-report.json",
    "target_file": "Makefile",
    "environment": {
      "image_uri": "registry.example.edu/pair04/dependency-demo@sha256:aaaaaaaaaaaaaaaaaaaaaaaaaaaaaaaaaaaaaaaaaaaaaaaaaaaaaaaaaaaaaaaa",
      "configuration_id": "cc-MODE0"
    },
    "build": {
      "command": "./mvnw -B clean package",
      "verify_command": "./mvnw -B test"
    }
  }
}
